Author	Rating 	Helpful - found	Helfpful%	Comments	Helpful - Total	Number of Records	Product Code	Product Name	User Rating	Sentiment	Usefulness	Product Posted On
Ashish Rajwade	5	0	0	"Reached well before the stated delivery date. The trimmer is really easy to use. I was a bit sceptical about the length settings, but they work just fine. Easy to clean. Barely occupies any space. At the price Amazon is offering, definitely recommend! This was the cheapest deal I got online. Comes pre charged, so can be used as soon as you get it."	0	1	B00CE3FT66	Philips QT4005/15 Beard and Stubble Trimmer (M-Power Play)	5.0 out of 5 stars	Negetive		05-10-2015
Raju	5	0	0	i am very about this product very reasonable price for this product	0	1	B00CE3FT66	Philips QT4005/15 Beard and Stubble Trimmer (M-Power Play)	5.0 out of 5 stars	Negetive		06-07-2015
syed sayeed uddin	5	0	0	"It is(Philips QT4005/15 Beard and Stubble Trimmer) good in performance .', 'Ergonomic design for easier handling', 'Light on the adaptor indicates when the battery is charging', 'Detachable head for easy cleaning', 'i am satisfied with this product."	0	1	B00CE3FT66	Philips QT4005/15 Beard and Stubble Trimmer (M-Power Play)	5.0 out of 5 stars	Negetive		06-06-2014
Vaibhav Pillai	5	0	0	The trimmer is very good. Shipping was quick and the product was received in excellent condition. It runs for 45-50 min before the battery drains out completely. A no-hassle product	0	1	B00CE3FT66	Philips QT4005/15 Beard and Stubble Trimmer (M-Power Play)	5.0 out of 5 stars	Negetive		06-10-2014
anil	5	0	0	Little bit charging problem. Tell me how much time I have to charge. I never saw green indication on adaptor even charging for 10 hours	0	1	B00CE3FT66	Philips QT4005/15 Beard and Stubble Trimmer (M-Power Play)	5.0 out of 5 stars	Negetive		07-04-2014
Surendar	5	0	0	"I have been using this trimmer for 10 months. I use this trimmer once in a week. So, approximately I have used it for almost 40 times.  Still its working fine. No problem as of now. The only disadvantage is, we can't use it while we charging and it takes 8 hr to get charged. Its really worth for the people who do trimming once in a week."	0	1	B00CE3FT66	Philips QT4005/15 Beard and Stubble Trimmer (M-Power Play)	5.0 out of 5 stars	Negetive		07-08-2015
Aravind Reddy	5	0	0	This is a very good product from Philips. True value for your money. Charge doesn't drain too fast and enables you to use multiple times over two weeks after charging once. The blades aren't harsh on the skin.	0	1	B00CE3FT66	Philips QT4005/15 Beard and Stubble Trimmer (M-Power Play)	5.0 out of 5 stars	Negetive		07-07-2014
davison damien	5	0	0	"Sooooper product , Philips always one step ahead. It\'s working very smoothly. But I can\'t register my product. Also the guarantee paper is not sealed .so I think it\'s not useful. In the packet they said "" if register the product you\'ll get additional 2 year guarantee.  It\'s worst"	0	1	B00CE3FT66	Philips QT4005/15 Beard and Stubble Trimmer (M-Power Play)	5.0 out of 5 stars	Negetive		07-07-2015
Gagandeep	5	0	0	"I loved this product... Although I have lost my charger so can any one tell me from where I will get the new charger.', 'I searched both philips and amazon site"	0	1	B00CE3FT66	Philips QT4005/15 Beard and Stubble Trimmer (M-Power Play)	5.0 out of 5 stars	Negetive		07-05-2015
KVR	5	0	0	very very sharp no complaint its been 7 months on this day worth of money 4.5/5 is my review	0	1	B00CE3FT66	Philips QT4005/15 Beard and Stubble Trimmer (M-Power Play)	5.0 out of 5 stars	Negetive		07-05-2015
naresh b	5	0	0	dont think too much it is awesome product  go for it blindly	0	1	B00CE3FT66	Philips QT4005/15 Beard and Stubble Trimmer (M-Power Play)	5.0 out of 5 stars	Negetive		07-10-2014
Deepak KS	5	0	0	Pretty much satisfied with the product. :)	0	1	B00CE3FT66	Philips QT4005/15 Beard and Stubble Trimmer (M-Power Play)	5.0 out of 5 stars	Negetive		07-09-2015
Stark	5	0	0	I got it for 1075 and even 1100 is worthful. Go fo this product during any sale time. It is preferrable than the earlier model of this which will have 1mm of transistion	0	1	B00CE3FT66	Philips QT4005/15 Beard and Stubble Trimmer (M-Power Play)	5.0 out of 5 stars	Negetive		07-09-2015
saravana	5	0	0	My reqt is completely met....really worthy and would recommend this product.	0	1	B00CE3FT66	Philips QT4005/15 Beard and Stubble Trimmer (M-Power Play)	5.0 out of 5 stars	Negetive		07-09-2015
Niraj Goel	5	0	0	"I checked lot and finaly I bought this . Its very nice trimmer . Good battery life , Trims to 0.5mm . Complete value for money product from Philips."	0	1	B00CE3FT66	Philips QT4005/15 Beard and Stubble Trimmer (M-Power Play)	5.0 out of 5 stars	Negetive		08-04-2014
Suranjan Das	5	0	0	"A real handy tool for men with a stubble, can also be used to trim non facial hair.Battery runs long. I used to think that such trimmers are unsafe if used without the cap, but the blade operation makes it evident that it does not depend on the sharpness but rather on the mechanics!', 'A must have!"	0	1	B00CE3FT66	Philips QT4005/15 Beard and Stubble Trimmer (M-Power Play)	5.0 out of 5 stars	Negetive		08-04-2014
Amlan Bandyopadhyay	5	0	0	It's a nice product for trimming my beard and the delivery was really quick(handed over to me within 40 hours of placing my order).	0	1	B00CE3FT66	Philips QT4005/15 Beard and Stubble Trimmer (M-Power Play)	5.0 out of 5 stars	Negetive		08-04-2015
Ayush tiwari	5	0	0	Its too good and Amazon delivered it on time and tha trimmer is very easy to handle it's working gr8	0	1	B00CE3FT66	Philips QT4005/15 Beard and Stubble Trimmer (M-Power Play)	5.0 out of 5 stars	Negetive		08-08-2014
istiaque choudhury	5	0	0	i choose 5 star bcoz i use this product and i feel vry comfort. it is also usefull for child hair cutting bcoz it is safe.	0	1	B00CE3FT66	Philips QT4005/15 Beard and Stubble Trimmer (M-Power Play)	5.0 out of 5 stars	Negetive		08-07-2014
sankar	5	0	0	were can i find the serial no. of the product . to register online to extent warranty	0	1	B00CE3FT66	Philips QT4005/15 Beard and Stubble Trimmer (M-Power Play)	5.0 out of 5 stars	Negetive		08-06-2015
abhishek sugirtharaj .S	5	0	0	it is uber cool and we barely miss a shaved effect with it's low length settings	0	1	B00CE3FT66	Philips QT4005/15 Beard and Stubble Trimmer (M-Power Play)	5.0 out of 5 stars	Negetive		08-10-2014
Jitu_15	5	0	0	Nice but the batter does works more than 2 hours.	0	1	B00CE3FT66	Philips QT4005/15 Beard and Stubble Trimmer (M-Power Play)	5.0 out of 5 stars	Negetive		09-08-2015
RAVIN K.	5	0	0	"Worth the money. I have been using it since last year. Till now, I didn't face any problem with this product."	0	1	B00CE3FT66	Philips QT4005/15 Beard and Stubble Trimmer (M-Power Play)	5.0 out of 5 stars	Negetive		09-08-2015
Urmil Khamar	5	0	0	"Convinient product. But beware, its not shaver.  Wont shave hair completely"	0	1	B00CE3FT66	Philips QT4005/15 Beard and Stubble Trimmer (M-Power Play)	5.0 out of 5 stars	Negetive		09-12-2014
R.SHANMUGAVEL	5	0	0	i have enjoy without any hurt on my face.intersing speed.	0	1	B00CE3FT66	Philips QT4005/15 Beard and Stubble Trimmer (M-Power Play)	5.0 out of 5 stars	Negetive		09-07-2015
deepak vaishnav	5	0	0	"Nice Product...', 'Nice Battery Backup..', 'I Buy This Product Just 1 Month Ago...', 'I UsE This Very Well....', 'Nice  But The Shave Is NoT Clean...', 'But Quality Is Very Good....."	0	1	B00CE3FT66	Philips QT4005/15 Beard and Stubble Trimmer (M-Power Play)	5.0 out of 5 stars	Negetive		09-06-2014
Iftikhar Hussain	5	0	0	Bought this trimmer for just Rs. 900 a year ago and i'm fully satisfied by the quality of philips and service of Amazon (not fake like flipkart.)	0	1	B00CE3FT66	Philips QT4005/15 Beard and Stubble Trimmer (M-Power Play)	5.0 out of 5 stars	Negetive		09-06-2015
Balaji	5	0	0	"Awsome there is  no till any problem.', 'Good product............."	0	1	B00CE3FT66	Philips QT4005/15 Beard and Stubble Trimmer (M-Power Play)	5.0 out of 5 stars	Negetive		09-11-2014
SABYASACHI BISHI	5	0	0	I received this product in time.thanx to Amazon providing delivery even in rural area.you can smoothly trim  your beard n moustache using this Philips trimmer. According to me its a good product.	0	1	B00CE3FT66	Philips QT4005/15 Beard and Stubble Trimmer (M-Power Play)	5.0 out of 5 stars	Negetive		09-11-2014
shreedeep	5	0	0	Totally worth it! Only problem is it doesn't have zero shave option!	0	1	B00CE3FT66	Philips QT4005/15 Beard and Stubble Trimmer (M-Power Play)	5.0 out of 5 stars	Negetive		09-11-2014
deepak	5	0	0	Definitely this products stands ahead. Completely value for money. Very much satisfied with charging and precision cutting. Blades are smooth and not too much noisy. And amazon packing is extremely satisfactory.	0	1	B00CE3FT66	Philips QT4005/15 Beard and Stubble Trimmer (M-Power Play)	5.0 out of 5 stars	Negetive		09-10-2014
Sai Sumanth	5	1	100	Excellent but one thing the top plastic lid is very loose. I dont know when it breaks	1	1	B00CE3FT66	Philips QT4005/15 Beard and Stubble Trimmer (M-Power Play)	5.0 out of 5 stars	Negetive	1 of 1 people found the following review helpful	15-05-2015
Tushar K.	5	1	100	"Super Fast delivery by Amazon.', 'Ordered on sunday evening and got it on Tuesday evening.  In about 52 hours.', 'Got this trimmer for Rs 940.', 'I can bet this is Was the lowest price for this trimmer.', 'Trimmer has 0.5 mm precision.', 'It makes a bit more sound.', 'Excited about using this trimmer."	1	1	B00CE3FT66	Philips QT4005/15 Beard and Stubble Trimmer (M-Power Play)	5.0 out of 5 stars	Negetive	1 of 1 people found the following review helpful	07-07-2015
Abby	5	1	50	"I purchase many times from Amazon and i found this trimmer at only 935 rs and all other sites sell this product 1200 above.', 'So the product is very amazing its very light weight and fast and precision size is start from 0.5 mm so you can trim your beard in very small size.', 'And you get 2 year warranty+ 1 year additional warranty means 3 year warranty so this is so amazing deal for this price point.', ""One thing i don't like about this product is this ptoduct is only use cordless."", 'At last but not the least amazon service and packaging are 5 star.."	2	1	B00CE3FT66	Philips QT4005/15 Beard and Stubble Trimmer (M-Power Play)	5.0 out of 5 stars	Negetive	1 of 2 people found the following review helpful	12-10-2014
Saikat Singha	5	1	50	Delivery time is awesome.The packing was good.next thing is the trimmer which is best trimmer in this range.one and only drawback is battery life it gives continuously run time of 35 min after a uninterrupted charge of 10hrs.bt its bearable because u'll never used this product continuously 35 min so I think after a full charge we can use it for a week.....	2	1	B00CE3FT66	Philips QT4005/15 Beard and Stubble Trimmer (M-Power Play)	5.0 out of 5 stars	Negetive	1 of 2 people found the following review helpful	09-08-2014
jayaprakash	5	16	80	"ABOUT AMZON SERVICE', u'Seller is offering one year warranty ,It had NO Signed Warranty Card .in warranty card it clearly mentioned that warranty can\xe2\x80\x99t claim if the card is properly stamped and signed by dealer. This is a Fulfilled by Amazon product ,it means s that products are stored, packed and dispatched by Amazon. Even it\xe2\x80\x99s a Fulfilled by Amazon product it has received without warranty card .If no warranty card then it . I AM GIVING THE 5 STAR ONLY FOR THE PRODUCT NOT FOR AMZON', 'ABOUT THE TRIMMER', 'planning to buy a trimmer for quite some time, and previously dissatisfied with the ""shavers"" for their unsatisfactory performance with longer than average beard, i was growing it out for quite some time as the online hunt was going on.', 'This being a newly launched 2013 model, with the price on the sweet spot and a trimming minimum length of ""0.5mm"" whereas most provide a min. of 1 mm, decided to go for it.', 'As usual, superhero fast fedex delivery and as i tore open the box i received in 2 days time , i just decided to zap a patch on my cheek, and MAN was it smooth and fast .....Leaves a perfect stubble and a nice close trim can be done within probably 3-4 minutes .', 'Comes pre-charged, use right out of the box. The motorhead is of high quality metal, never doubt thats ever going to give a problem."	20	1	B00CE3FT66	Philips QT4005/15 Beard and Stubble Trimmer (M-Power Play)	5.0 out of 5 stars	Negetive	16 of 20 people found the following review helpful	28-10-2014
Aniket Parasharami	5	2	66.66666667	"I bought Philips QT4005/15 Beard and Stubble Trimmer after a long research on web.', 'I found this trimmer really value for money.', 'The best things about this trimmer are:', '1. Precision', '2. Light weight', '3. Easy to clean', '4. Easy to use', 'Cons are:', '1. Battery backup (35 min after 10 hour charging)', ""This is one of the best trimmer and not shaver so please don't think that you will get a clean shave after using this."", 'Go for this trimmer and you will not regret your decision."	3	1	B00CE3FT66	Philips QT4005/15 Beard and Stubble Trimmer (M-Power Play)	5.0 out of 5 stars	Negetive	2 of 3 people found the following review helpful	25-09-2013
Mithun yadav	5	2	66.66666667	"Bought it a month ago  @rs 971.00, almost used every 2nd day, here's the review."", 'Backup and Charging:', '1) Charging Time: 8-10hrs, may increase with time with normal wear and tear as with every product.', 'a) Runs for 30-35 Minutes, even more, on a single charge, One charge is basically enough for 10days!', '2) Trimming, Styling hardly takes 2-3minutes, So one charge is more than sufficient for your needs, Hence, battery backup should not be an issue, charge once a week, and it will go fine for years.', ""3) All those saying it isn't corded, It's for your own good, Imagine the risk of getting an electric shock while trimming your beard, You won't want that, Right?? And you will also not run it for whole 35-40 minutes at one go. Maximum 5 minutes is what you'll run it, hence, backup is more then Enough."", 'Performance:', ""1) Product performs flawless, cuts hairs smoothly, no matter how long your beard has grown. I've been using Philips Shaver too, and even after 3 years, it runs as good a it was for 1st day. Although, used moderately. So blades should not be in doubt."", '2) Yes, No Oiling needed.', ""3) Washable blades, Easily removable and cleanable, However, I didn't find usage of washing it, a blow of air is enough to clean it."", '4) Less vibrations and moderate sound. Comfortable for user.', 'Philips has been a well known very reliable brand in India and the world for decades. Philips QT4005/15', 'sold as a Beard and Stubble Trimmer is in fact a multi-purpose Trimmer. I have not used it for long-hair clipping but does a great job with the sideburns besides what it is intended for, the beard and stubble. It does the job without much noise, charging itself for several uses and no nicks, no cuts and no catching of the skin. I wonder why I did not buy it earlier. A great gadget.', 'Using it with Philips AT890/16 shaver I feel happy with a look of my choice always."	3	1	B00CE3FT66	Philips QT4005/15 Beard and Stubble Trimmer (M-Power Play)	5.0 out of 5 stars	Negetive	2 of 3 people found the following review helpful	29-12-2014
Anil	5	2	66.66666667	"100% Satisfied for the amount paid ,only charging kept for one time , but using for more than 10 times for trimming of beard.', 'i have used for more than 2 weeks, no problem with trimmer, philips has released a good product,It is worthy for one time spending money for trimmer than buying the loca brands 5 times a year,valuing more than what we spend on this single trimmer,10 blade settings good, can make different style of beards, easy to handle, smooth functioning ,of trimmer,"	3	1	B00CE3FT66	Philips QT4005/15 Beard and Stubble Trimmer (M-Power Play)	5.0 out of 5 stars	Negetive	2 of 3 people found the following review helpful	07-08-2014
RAVINDRAN S	5	3	75	Thank you Amazon for rebuilding my trust in Philips. Somewhere down the line we had forgotten Philips. I was wary and hesitant to try out their products. We don't get to see them in shops now flooded with cheap Chinese gadgets. I came across this product on a mail received from Amazon and then I did not hesitate to try it out. Its a winner all the way and a must own item for all beard loving alpha males. For the price you pay it is a steal.Even if it lasts for month I have got my moneys worth. (Philips gives 2 year warranty.) Matchless in price and quality.	4	1	B00CE3FT66	Philips QT4005/15 Beard and Stubble Trimmer (M-Power Play)	5.0 out of 5 stars	Negetive	3 of 4 people found the following review helpful	09-09-2014
Ankit Sahu	1	0	0	not working where can repair it in crossing republik	0	1	B00CE3FT66	Philips QT4005/15 Beard and Stubble Trimmer (M-Power Play)	1.0 out of 5 stars	neutral		10-09-2015
Parvesh Gandhi	1	0	0	Stopped Working While Using Very First time.	0	1	B00CE3FT66	Philips QT4005/15 Beard and Stubble Trimmer (M-Power Play)	1.0 out of 5 stars	neutral		29-09-2015
vijaykrishna316	1	0	0	it is not skin friendly...im injuring my beard always during trimming...one of the waste products from philips supported by Amazon...Betrayed by Amazon.in	0	1	B00CE3FT66	Philips QT4005/15 Beard and Stubble Trimmer (M-Power Play)	1.0 out of 5 stars	neutral		08-08-2015
chaman singh negi	1	0	0	Charger is not working.battery problem.	0	1	B00CE3FT66	Philips QT4005/15 Beard and Stubble Trimmer (M-Power Play)	1.0 out of 5 stars	neutral		09-11-2014
Manchuri	1	1	100	This not working and need repair	1	1	B00CE3FT66	Philips QT4005/15 Beard and Stubble Trimmer (M-Power Play)	1.0 out of 5 stars	neutral	1 of 1 people found the following review helpful	02-10-2015
atuf muqri	1	1	100	Charger wont work within 2 days	1	1	B00CE3FT66	Philips QT4005/15 Beard and Stubble Trimmer (M-Power Play)	1.0 out of 5 stars	neutral	1 of 1 people found the following review helpful	26-01-2015
Hussain Basha S	1	1	100	"Continuosly it is getting stucked in the middle...', 'Now it is completely stopped working.', 'Where to get it repaired. Please suggest."	1	1	B00CE3FT66	Philips QT4005/15 Beard and Stubble Trimmer (M-Power Play)	1.0 out of 5 stars	neutral	1 of 1 people found the following review helpful	27-05-2015
chiatanya	1	1	100	Sometimes stops working	1	1	B00CE3FT66	Philips QT4005/15 Beard and Stubble Trimmer (M-Power Play)	1.0 out of 5 stars	neutral	1 of 1 people found the following review helpful	09-05-2015
Deep prabhat	2	0	0	"Not satisfied,', 'packet was already opened."	0	1	B00CE3FT66	Philips QT4005/15 Beard and Stubble Trimmer (M-Power Play)	2.0 out of 5 stars	neutral		14-09-2015
Durgesh Ojha	2	0	0	"The battery life is very short, every time prior to use i have to charge it. sometimes it turned off while suing also and FYI it was fully charged a day before using."	0	1	B00CE3FT66	Philips QT4005/15 Beard and Stubble Trimmer (M-Power Play)	2.0 out of 5 stars	neutral		16-12-2014
yogesh sanwariya	2	0	0	I get internally problem into it after 6 month  but warranty period is 2 year However I replace it	0	1	B00CE3FT66	Philips QT4005/15 Beard and Stubble Trimmer (M-Power Play)	2.0 out of 5 stars	neutral		17-07-2015
rahul singh	2	0	0	why the price is kept so high...one can get similar performance from local brands...then why philips with 4X cost..?	0	1	B00CE3FT66	Philips QT4005/15 Beard and Stubble Trimmer (M-Power Play)	2.0 out of 5 stars	neutral		18-09-2015
sahil bharars	2	0	0	Battery gets discharged in a short time....	0	1	B00CE3FT66	Philips QT4005/15 Beard and Stubble Trimmer (M-Power Play)	2.0 out of 5 stars	neutral		24-08-2015
Ruchir Vyas	2	0	0	Power connectivity and battery stopped working within 2 months of infrequent usage ..	0	1	B00CE3FT66	Philips QT4005/15 Beard and Stubble Trimmer (M-Power Play)	2.0 out of 5 stars	neutral		27-03-2015
Adithan M	2	0	0	My trimmer stopped working in 9th month.	0	1	B00CE3FT66	Philips QT4005/15 Beard and Stubble Trimmer (M-Power Play)	2.0 out of 5 stars	neutral		04-04-2015
Mahantesh K.	3	0	0	Does job but after few months of usage the steel place (cutter) which slides stopped sliding. I see the motor is running but unable to catch hold of the sliding plate for movement.	0	1	B00CE3FT66	Philips QT4005/15 Beard and Stubble Trimmer (M-Power Play)	3.0 out of 5 stars	neutral		11-08-2015
Senthilkumar AK	3	0	0	"Within 4 months itself, charger is not functioning at all.."	0	1	B00CE3FT66	Philips QT4005/15 Beard and Stubble Trimmer (M-Power Play)	3.0 out of 5 stars	neutral		13-10-2015
kamal	3	0	0	Has to be run multiple times to get complete trimming. Battery power is good. Delivered in time.	0	1	B00CE3FT66	Philips QT4005/15 Beard and Stubble Trimmer (M-Power Play)	3.0 out of 5 stars	neutral		14-10-2014
Arun P V	3	0	0	Product not d best... Need to give atleast 5 passes to trim the same area...	0	1	B00CE3FT66	Philips QT4005/15 Beard and Stubble Trimmer (M-Power Play)	3.0 out of 5 stars	neutral		15-04-2015
saurabh chamedia	3	0	0	"Guys who are used to shave, trimming doesn't work for them. So if you currently shave and are planning to purchase this in order to avoid shave & start trimming then don't buy it because you will not get satisfied as per your expectations. Trimming is never same as shaving using this product."	0	1	B00CE3FT66	Philips QT4005/15 Beard and Stubble Trimmer (M-Power Play)	3.0 out of 5 stars	neutral		17-10-2014
Ritvik Agarwal	3	0	0	Everything was good except the additional warranty promised on the product by registration. As the product was not listed in the Philips website.	0	1	B00CE3FT66	Philips QT4005/15 Beard and Stubble Trimmer (M-Power Play)	3.0 out of 5 stars	neutral		18-11-2014
Nagendra	3	0	0	Have to charge more time for 30 mins use	0	1	B00CE3FT66	Philips QT4005/15 Beard and Stubble Trimmer (M-Power Play)	3.0 out of 5 stars	neutral		21-05-2015
umang	3	0	0	Flimsy detachable comb.Settings from .5mm to 2mm do no make any difference since pressing the trimmer against the face moves the comb and negates the effect.Rest all settings are fine.works as described.	0	1	B00CE3FT66	Philips QT4005/15 Beard and Stubble Trimmer (M-Power Play)	3.0 out of 5 stars	neutral		25-02-2015
Vanrajsinh Bihola	3	0	0	Charging for trimmer is time consuming...!!.....what the hell...charger is not working after few month..where to get new one or any online of offline suppport....center in ahmedabad	0	1	B00CE3FT66	Philips QT4005/15 Beard and Stubble Trimmer (M-Power Play)	3.0 out of 5 stars	neutral		05-09-2014
Anant Kumar	3	0	0	It's alright...gotta make several passes to get the even height	0	1	B00CE3FT66	Philips QT4005/15 Beard and Stubble Trimmer (M-Power Play)	3.0 out of 5 stars	neutral		07-07-2015
Sagar Sharma	3	0	0	"Nice product & value for money.', 'Good for use during Travel & quick Trimming needs.', 'A must Buy for students & those who donot want to spend long time shaving daily."	0	1	B00CE3FT66	Philips QT4005/15 Beard and Stubble Trimmer (M-Power Play)	3.0 out of 5 stars	neutral		08-07-2014
Vinod S	3	2	66.66666667	"The product is fine and later 3 months the philips trimmer is not working (charging ) , It is unable to charge don't know what happen. Charger is working fine for the other trimmer, when I plug the charger to the my trimmer the light indicator is not showing. Same charger plug to other philips trimmer (friends) it is showing the indicator."", 'let us know how to complain to trimmer and get it repaire"	3	1	B00CE3FT66	Philips QT4005/15 Beard and Stubble Trimmer (M-Power Play)	3.0 out of 5 stars	neutral	2 of 3 people found the following review helpful	31-07-2014
Prateek Goyal	4	0	0	Using Last 6 months Good Product Nice Battery life trim your shave up to 3-4 times in full charge.Really Happy to buy this product :)	0	1	B00CE3FT66	Philips QT4005/15 Beard and Stubble Trimmer (M-Power Play)	4.0 out of 5 stars	neutral		01-07-2014
Binaya	4	0	0	In men's grooming department Philips is a leader .. Awesome trimmer ..	0	1	B00CE3FT66	Philips QT4005/15 Beard and Stubble Trimmer (M-Power Play)	4.0 out of 5 stars	neutral		10-06-2015
RAHEEL BUDHA	4	0	0	"electric powered with recharge time 600 minute was great', 'and thanks to amazon on such quick delivery even on the day of augest 15"	0	1	B00CE3FT66	Philips QT4005/15 Beard and Stubble Trimmer (M-Power Play)	4.0 out of 5 stars	neutral		10-09-2014
JV	4	0	0	good product...however more close trimming was expected	0	1	B00CE3FT66	Philips QT4005/15 Beard and Stubble Trimmer (M-Power Play)	4.0 out of 5 stars	neutral		11-08-2015
Saurabh Kumar	4	0	0	Value for money and useful product for beginners in this regard.	0	1	B00CE3FT66	Philips QT4005/15 Beard and Stubble Trimmer (M-Power Play)	4.0 out of 5 stars	neutral		11-03-2015
Harshad S.	4	0	0	Thank you Amazon for the help of bying such a lovely products...	0	1	B00CE3FT66	Philips QT4005/15 Beard and Stubble Trimmer (M-Power Play)	4.0 out of 5 stars	neutral		12-04-2015
'Susovan\xc2\xa0Kumar\xc2\xa0Sahoo	4	0	0	"as expected from Philips...working fine', 'the different ranges of this trimmer is also noticeable & battery power is also upto expectation."	0	1	B00CE3FT66	Philips QT4005/15 Beard and Stubble Trimmer (M-Power Play)	4.0 out of 5 stars	neutral		13-02-2014
deepanshu gupta	4	0	0	"got it within 5 days ,at rs 1025,,,value for money,,,', 'writing this review after one month usage,,,cant expect more,, from philips in this price,,,and with 2yars warranty+additional 1 years from philips online"	0	1	B00CE3FT66	Philips QT4005/15 Beard and Stubble Trimmer (M-Power Play)	4.0 out of 5 stars	neutral		13-01-2015
sudesh d s	4	0	0	"superb product as desired, good seller, will love to deal in future"	0	1	B00CE3FT66	Philips QT4005/15 Beard and Stubble Trimmer (M-Power Play)	4.0 out of 5 stars	neutral		13-07-2015
mehul solanki	4	0	0	Using it since last one year no problems till now	0	1	B00CE3FT66	Philips QT4005/15 Beard and Stubble Trimmer (M-Power Play)	4.0 out of 5 stars	neutral		13-06-2015
