Author	Rating 	Helpful - found	Helfpful%	Comments	Helpful - Total	Number of Records	Product Code	Product Name	User Rating	Sentiment	Usefulness	Product Posted On
adarsh	4	1	100	AMAZING PRODUCT...COMFRTBLE...HANDY...GOOD BATTERY BACKUP...	1	1	B00CE3FT66	Philips QT4005/15 Beard and Stubble Trimmer (M-Power Play)	4.0 out of 5 stars	Positive	1 of 1 people found the following review helpful	14-11-2014
Amazon Customer	4	1	100	Great product	1	1	B00CE3FT66	Philips QT4005/15 Beard and Stubble Trimmer (M-Power Play)	4.0 out of 5 stars	Positive	1 of 1 people found the following review helpful	14-10-2015
Amazon Customer	4	1	100	"Very Good, As well as expected."	1	1	B00CE3FT66	Philips QT4005/15 Beard and Stubble Trimmer (M-Power Play)	4.0 out of 5 stars	Positive	1 of 1 people found the following review helpful	14-10-2015
MOHAMED ADAM ABDULLAH	4	1	100	Sytlish and confortable. Make me beautiful.	1	1	B00CE3FT66	Philips QT4005/15 Beard and Stubble Trimmer (M-Power Play)	4.0 out of 5 stars	Positive	1 of 1 people found the following review helpful	18-08-2014
sarath chandran c	4	1	100	Its quite ok to use. Anyway you will not get the kind of trim which is shown on the video of this product. But still i like the stuff. Amazone provided this at best possible rate when compared with other online retailers and shops. Also when i registered the product with philips i got another year of warrenty. All together good experience.	1	1	B00CE3FT66	Philips QT4005/15 Beard and Stubble Trimmer (M-Power Play)	4.0 out of 5 stars	Positive	1 of 1 people found the following review helpful	18-07-2014
k.k.patnaik	4	1	100	it's nice to use	1	1	B00CE3FT66	Philips QT4005/15 Beard and Stubble Trimmer (M-Power Play)	4.0 out of 5 stars	Positive	1 of 1 people found the following review helpful	24-09-2015
mukesh goel	4	1	100	This is a good trimmer	1	1	B00CE3FT66	Philips QT4005/15 Beard and Stubble Trimmer (M-Power Play)	4.0 out of 5 stars	Positive	1 of 1 people found the following review helpful	26-06-2015
VK_27	4	1	100	"One of the best available trimmer at this price range. (Especially for it's build quality)"", 'Ergonomically, good! Easy to hold and use. Although, It requires some time to get a proper hold of it, especially if this is your first trimmer. Good for College boys and to an extent for semi-professionals as well. But if you are looking for an exceptional performance, then obviously loosen your pockets a bit.', 'The only downside, It may get a little tricky to clean sometimes.', 'Gave 4 out of 5 stars because it deserves 4 out of 5 stars."	1	1	B00CE3FT66	Philips QT4005/15 Beard and Stubble Trimmer (M-Power Play)	4.0 out of 5 stars	Positive	1 of 1 people found the following review helpful	26-10-2014
chakradhar	4	1	100	"First of all thanks to the amazon for providing such a good quality trimmer..', ""The package of item of is also good without any damage to the product.Before opening the package i thought that it was an ordinary trimmer but after opening the pack i can't believe myself ..."", ' that the trimmer is very smooth and comfortable for holding and it works very smooth.  It merely looks like shaving.. most advantage is it having 0.5 precision .."	1	1	B00CE3FT66	Philips QT4005/15 Beard and Stubble Trimmer (M-Power Play)	4.0 out of 5 stars	Positive	1 of 1 people found the following review helpful	30-10-2014
Shekhar Jadhav	4	1	100	"Value for money. Good quality .', 'Cons: battery charging time should be improved"	1	1	B00CE3FT66	Philips QT4005/15 Beard and Stubble Trimmer (M-Power Play)	4.0 out of 5 stars	Positive	1 of 1 people found the following review helpful	31-07-2015
Sagar Baldwa	4	1	100	Worth the price. Handy and gives pretty close to clean shave look. Adding the power charging indicator would have been good. Overall satisfied with the product purchase.	1	1	B00CE3FT66	Philips QT4005/15 Beard and Stubble Trimmer (M-Power Play)	4.0 out of 5 stars	Positive	1 of 1 people found the following review helpful	05-03-2015
prasad	4	1	100	Nice Product	1	1	B00CE3FT66	Philips QT4005/15 Beard and Stubble Trimmer (M-Power Play)	4.0 out of 5 stars	Positive	1 of 1 people found the following review helpful	08-11-2014
SANDEEP KUMAR SAHA	4	1	100	its good.	1	1	B00CE3FT66	Philips QT4005/15 Beard and Stubble Trimmer (M-Power Play)	4.0 out of 5 stars	Positive	1 of 1 people found the following review helpful	09-09-2014
Bhargav	4	1	50	"My first order with Amazon India - And I must say , very much impressed. The product looks great , comes well packed . The performance is great as well - If you know how to use the device. Easy to clean and store. The shape the device gives nice grip hold. If you are planning to buy a Trimmer - Go ahead with this ."	2	1	B00CE3FT66	Philips QT4005/15 Beard and Stubble Trimmer (M-Power Play)	4.0 out of 5 stars	Positive	1 of 2 people found the following review helpful	09-12-2013
Janardhan	4	10	90.90909091	"Best part is that it is less weight and easy good to handle and use.', 'This product is having a warranty of two years. Charging option is also ok"	11	1	B00CE3FT66	Philips QT4005/15 Beard and Stubble Trimmer (M-Power Play)	4.0 out of 5 stars	Positive	10 of 11 people found the following review helpful	27-06-2014
D RAVI CHANDRA	4	101	91.81818182	"Perfect Delivery, Original Prdoduct, working good,  extended warranty by registering in philips(to register take a snap on invoice of amazon attached to packed box ), thank you amazon...i have Satisfied"	110	1	B00CE3FT66	Philips QT4005/15 Beard and Stubble Trimmer (M-Power Play)	4.0 out of 5 stars	Positive	101 of 110 people found the following review helpful	05-11-2014
Amazon Customer	4	2	66.66666667	Good product. Gdhh.x bxb.xbjdd.zbhdh xghzdbhx zhdvhd hdbb zhdhdb vzbdbdh zgbssv shdhb hsdbd dhhdhd djhfhf dbdb bdhdh dvbdb dbdb dvdv dhdh	3	1	B00CE3FT66	Philips QT4005/15 Beard and Stubble Trimmer (M-Power Play)	4.0 out of 5 stars	Positive	2 of 3 people found the following review helpful	13-05-2014
Ajit	4	27	96.42857143	"This is a nice trimmer. It has a Good Battery life, but require long time for charging.This gives a precision trimming."	28	1	B00CE3FT66	Philips QT4005/15 Beard and Stubble Trimmer (M-Power Play)	4.0 out of 5 stars	Positive	27 of 28 people found the following review helpful	12-12-2013
Ravikumar Arumugam	4	4	80	I am really happy with this product and it's easy to use. It's also safe on my lips while trimming my moustache.	5	1	B00CE3FT66	Philips QT4005/15 Beard and Stubble Trimmer (M-Power Play)	4.0 out of 5 stars	Positive	4 of 5 people found the following review helpful	12-12-2013
Shashikant Kumar	4	5	83.33333333	Best products	6	1	B00CE3FT66	Philips QT4005/15 Beard and Stubble Trimmer (M-Power Play)	4.0 out of 5 stars	Positive	5 of 6 people found the following review helpful	21-02-2015
Shikhar Arora	5	0	0	"i am really satisfied with this trimmer, very clean trimming, i hav used many trimmers and i can say that it is best in it's range"", 'yeah but also you can get better investing some more money"	0	1	B00CE3FT66	Philips QT4005/15 Beard and Stubble Trimmer (M-Power Play)	5.0 out of 5 stars	Positive		01-04-2014
Anonymous	5	0	0	nice one works perfect but investing this much is not needed u can go for trimmers in <1000 range	0	1	B00CE3FT66	Philips QT4005/15 Beard and Stubble Trimmer (M-Power Play)	5.0 out of 5 stars	Positive		01-04-2015
Manish Jain	5	0	0	"This is best one, nice battery life (even not charged for 2 hrs) very good for face as mentioned in specifications.', 'Go for it."	0	1	B00CE3FT66	Philips QT4005/15 Beard and Stubble Trimmer (M-Power Play)	5.0 out of 5 stars	Positive		01-04-2015
basani pranay	5	0	0	it's a good product i think it will work for more than 5 years	0	1	B00CE3FT66	Philips QT4005/15 Beard and Stubble Trimmer (M-Power Play)	5.0 out of 5 stars	Positive		01-04-2015
vishnuM	5	0	0	Philips is the quality and durability... Buy it its budget and nice one	0	1	B00CE3FT66	Philips QT4005/15 Beard and Stubble Trimmer (M-Power Play)	5.0 out of 5 stars	Positive		01-04-2015
MANOJ C M	5	0	0	"Its Excellent product .......', 'Amazing back up for more than 45 minutes........."	0	1	B00CE3FT66	Philips QT4005/15 Beard and Stubble Trimmer (M-Power Play)	5.0 out of 5 stars	Positive		01-08-2014
david paul neela	5	0	0	"Excellent product, value for money. One the best purchases we have made in recent times, this also came with 2 years extended warranty."	0	1	B00CE3FT66	Philips QT4005/15 Beard and Stubble Trimmer (M-Power Play)	5.0 out of 5 stars	Positive		01-12-2013
Manish	5	0	0	"I got it before the delivery time they told me before. Product is very good as it is genuine Phillips Trimmer, Battery is also working fine. Overall good experience."	0	1	B00CE3FT66	Philips QT4005/15 Beard and Stubble Trimmer (M-Power Play)	5.0 out of 5 stars	Positive		01-01-2015
AJAY JOHN	5	0	0	Excellent product it was easy to use and worth buying it....most features are only available in higher products i.e above Rs 3000 and its a plus point	0	1	B00CE3FT66	Philips QT4005/15 Beard and Stubble Trimmer (M-Power Play)	5.0 out of 5 stars	Positive		01-07-2014
Manoj Kumar	5	0	0	"Smooth and close trim.', 'The clip has 0.5 mm which almost gives a zero trim look...', 'Battery is also good."	0	1	B00CE3FT66	Philips QT4005/15 Beard and Stubble Trimmer (M-Power Play)	5.0 out of 5 stars	Positive		01-07-2014
srinivas	5	0	0	"very nice product..........', 'I love the products in amazon site', 'I am very happy to give 5 star rating to this product"	0	1	B00CE3FT66	Philips QT4005/15 Beard and Stubble Trimmer (M-Power Play)	5.0 out of 5 stars	Positive		01-07-2014
Nahas Mohamedali	5	0	0	Have been using for 6 months. So far so good. May definitely go for this.	0	1	B00CE3FT66	Philips QT4005/15 Beard and Stubble Trimmer (M-Power Play)	5.0 out of 5 stars	Positive		01-06-2015
Pavan Thute	5	0	0	"Almost doing everything as said in advertisement. [...] . Its easy to use, charge and clean. I am happy with the purchase."	0	1	B00CE3FT66	Philips QT4005/15 Beard and Stubble Trimmer (M-Power Play)	5.0 out of 5 stars	Positive		01-05-2014
It is best thing forever	5	0	0	the blade quality is so good if u buy it u donot think to buy any other. It is benifical for ur and other member in family.	0	1	B00CE3FT66	Philips QT4005/15 Beard and Stubble Trimmer (M-Power Play)	5.0 out of 5 stars	Positive		01-11-2014
surendar	5	0	0	"hi,its a good product, feel like a shaving effect...."	0	1	B00CE3FT66	Philips QT4005/15 Beard and Stubble Trimmer (M-Power Play)	5.0 out of 5 stars	Positive		01-10-2014
Ravi kumar	5	0	0	"Excellent product by Phillips', 'Bahut Hi achchi trimming karta h', 'easy to use"	0	1	B00CE3FT66	Philips QT4005/15 Beard and Stubble Trimmer (M-Power Play)	5.0 out of 5 stars	Positive		01-10-2015
Amit	5	0	0	Excellent product for its price. Easy to use with good precision.	0	1	B00CE3FT66	Philips QT4005/15 Beard and Stubble Trimmer (M-Power Play)	5.0 out of 5 stars	Positive		01-09-2014
Rahul yadav	5	0	0	Easy to use ..lesser sound then other trimmers....& packing was good ....thanks amazon..	0	1	B00CE3FT66	Philips QT4005/15 Beard and Stubble Trimmer (M-Power Play)	5.0 out of 5 stars	Positive		01-09-2014
Seema	5	0	0	"I have been using it for 8 months. Works well for personal use, saves the need to go to barber shop."	0	1	B00CE3FT66	Philips QT4005/15 Beard and Stubble Trimmer (M-Power Play)	5.0 out of 5 stars	Positive		01-09-2014
KOUSHIK SARKAR	5	0	0	Trim very effectively. Good product from Phillips.	0	1	B00CE3FT66	Philips QT4005/15 Beard and Stubble Trimmer (M-Power Play)	5.0 out of 5 stars	Positive		01-09-2015
Sourav Choudhury	5	0	0	Very good product. I love using this. Takes no time at all to get a good look	0	1	B00CE3FT66	Philips QT4005/15 Beard and Stubble Trimmer (M-Power Play)	5.0 out of 5 stars	Positive		01-09-2015
Ajay George Varghese	5	0	0	"This product is awesome,...gets charged really fast and really powerfull"	0	1	B00CE3FT66	Philips QT4005/15 Beard and Stubble Trimmer (M-Power Play)	5.0 out of 5 stars	Positive		10-04-2015
Ashutosh Singh	5	0	0	Absolutely Amazin!!Before time delivery:))	0	1	B00CE3FT66	Philips QT4005/15 Beard and Stubble Trimmer (M-Power Play)	5.0 out of 5 stars	Positive		10-04-2015
Prasanna Chandra	5	0	0	Good trimmer for a stubble and trimming casually. You can't style  using this trimmer.The design helps to ease the usage.Using it for 2 years and its still working fine.	0	1	B00CE3FT66	Philips QT4005/15 Beard and Stubble Trimmer (M-Power Play)	5.0 out of 5 stars	Positive		10-08-2015
Praveen Bharath Varanasi	5	0	0	Its a very good Product. Giving feel good performance.  I suggest everyone to buy this Trimmer without any any hesitation..	0	1	B00CE3FT66	Philips QT4005/15 Beard and Stubble Trimmer (M-Power Play)	5.0 out of 5 stars	Positive		10-08-2015
Roshan	5	0	0	good product  easy to use value for  money..	0	1	B00CE3FT66	Philips QT4005/15 Beard and Stubble Trimmer (M-Power Play)	5.0 out of 5 stars	Positive		10-08-2015
Malleswara Sastry	5	0	0	"Very good product. I have been using it from many months now and there is no issue, it provides many lengths as mentioned in the product overview. I would recommend to take this on any day."	0	1	B00CE3FT66	Philips QT4005/15 Beard and Stubble Trimmer (M-Power Play)	5.0 out of 5 stars	Positive		10-12-2014
shivank	5	0	0	Nice trimmer with a good battery back up	0	1	B00CE3FT66	Philips QT4005/15 Beard and Stubble Trimmer (M-Power Play)	5.0 out of 5 stars	Positive		10-12-2014
Deep Chawla	5	0	0	One word its really awesome. Nice options for sizes. Nice battery backup but it should display signal when it is fully charged which is not there.	0	1	B00CE3FT66	Philips QT4005/15 Beard and Stubble Trimmer (M-Power Play)	5.0 out of 5 stars	Positive		10-02-2014
Kaizaad K @starzshowz	5	0	0	overall a good product am not sure if it water proof tho rest all works wish it came with a stand	0	1	B00CE3FT66	Philips QT4005/15 Beard and Stubble Trimmer (M-Power Play)	5.0 out of 5 stars	Positive		10-02-2014
Nikhil Prathapani	5	0	0	"With 10-12 hours of charge, it is working upto 30 minutes. What i loved is the powerplay they have introduces in this model. As always, amazon has delivered it within short time and also good packaging.definitely worth it!"	0	1	B00CE3FT66	Philips QT4005/15 Beard and Stubble Trimmer (M-Power Play)	5.0 out of 5 stars	Positive		10-02-2014
Satyajeet Mishra	5	0	0	It's perfect with the cost.. No prbs at all.. Smooth.. Feasible.. Awesome battery power... What else required.. Too good. Rocking	0	1	B00CE3FT66	Philips QT4005/15 Beard and Stubble Trimmer (M-Power Play)	5.0 out of 5 stars	Positive		10-02-2014
vishal anand	5	0	0	"just amazing trimmer....', 'slim design..easy to hold....nice trimming..... five out of five. best part is if you have registered the product on philips website,the warranty is extended."	0	1	B00CE3FT66	Philips QT4005/15 Beard and Stubble Trimmer (M-Power Play)	5.0 out of 5 stars	Positive		10-02-2014
Akshay K	5	0	0	"Absolutely Amazing product.', 'The functionality is damn smooth and it goes very slightly on your skin without any burns and cuts.', 'Happy with the product. I hope it continues functioning the same, always.', 'Wel! Amazon!! The packaging was as usual the perfect one! Just awesome service as usual!', 'Love Amazon For its continued Perfect Service', 'Keep up the good work!"	0	1	B00CE3FT66	Philips QT4005/15 Beard and Stubble Trimmer (M-Power Play)	5.0 out of 5 stars	Positive		10-02-2015
swapnil	5	0	0	"product is really awesome', 'i love it', 'its really very smooth and hav no problem at all', 'its money saver and time tooo', 'i would surely prefer anyone to take it', 'its easy to clean also"	0	1	B00CE3FT66	Philips QT4005/15 Beard and Stubble Trimmer (M-Power Play)	5.0 out of 5 stars	Positive		10-02-2015
kiran kumar	5	0	0	Perfect budget fit..Easy use lasts more than 40 min once charged..!	0	1	B00CE3FT66	Philips QT4005/15 Beard and Stubble Trimmer (M-Power Play)	5.0 out of 5 stars	Positive		10-01-2015
AKHIL	5	0	0	very nice product...5 stars...available at very good price at amazon.go for it...good delivery...very good functioning..easy to charge..battery backup is great..	0	1	B00CE3FT66	Philips QT4005/15 Beard and Stubble Trimmer (M-Power Play)	5.0 out of 5 stars	Positive		10-07-2014
P. Rana	5	0	0	"Amazon service is good..and regarding the philips qt 4005 trimmer..its working good ..its nice ..smooth and easy to use..battery backup is good..after charging 8-10 hrs..i used it 5 times in two weeks ..so overall good experience on using philips trimmer..', 'Thanks"	0	1	B00CE3FT66	Philips QT4005/15 Beard and Stubble Trimmer (M-Power Play)	5.0 out of 5 stars	Positive		10-07-2014
Gaurav Kumar Tak	5	0	0	Amazing product with amazing packaging. Original product with full warranty.	0	1	B00CE3FT66	Philips QT4005/15 Beard and Stubble Trimmer (M-Power Play)	5.0 out of 5 stars	Positive		10-07-2015
Ayyappa S M	5	0	0	"I will definitely recommend this product with comparison in its class..', 'Truly worth for the money and compatable during use.', 'Go for it if u are lokking for a good trimmer.."	0	1	B00CE3FT66	Philips QT4005/15 Beard and Stubble Trimmer (M-Power Play)	5.0 out of 5 stars	Positive		10-06-2014
Felix Manojh	5	0	0	The product is very good for the price it is being offered. Have had a pretty smooth experience so far.	0	1	B00CE3FT66	Philips QT4005/15 Beard and Stubble Trimmer (M-Power Play)	5.0 out of 5 stars	Positive		10-06-2014
akhil	5	0	0	works like a charm and is very easy to maintain . settings are pretty sleek . overall a must buy :)	0	1	B00CE3FT66	Philips QT4005/15 Beard and Stubble Trimmer (M-Power Play)	5.0 out of 5 stars	Positive		10-06-2014
eldhoperikilath	5	0	0	"value for money,  easy to use , battery back up is good , always philips is good nice nice nice"	0	1	B00CE3FT66	Philips QT4005/15 Beard and Stubble Trimmer (M-Power Play)	5.0 out of 5 stars	Positive		10-06-2014
Shantnu Kasture	5	0	0	"it is workings good, user friendly soft ware, it is so easy to use, we can make calls also while using this unit."	0	1	B00CE3FT66	Philips QT4005/15 Beard and Stubble Trimmer (M-Power Play)	5.0 out of 5 stars	Positive		10-03-2014
sridhar adupa	5	0	0	"product is good from Philips and the service by Amazon is also very nice i liked it.', 'Very Good !!!!!!!"	0	1	B00CE3FT66	Philips QT4005/15 Beard and Stubble Trimmer (M-Power Play)	5.0 out of 5 stars	Positive		10-03-2014
MD Afroz Chouri	5	0	0	"thank you Amazon for delivering it as promised,  Packaging was really damn good, better than flipkart and snapdeal.  Loved the way it was packaged, trimmer is really as good as its mentioned in its spec. Many settings,  stylish looks, a clean trim,  A must have trimmer for all.... just go for it...."	0	1	B00CE3FT66	Philips QT4005/15 Beard and Stubble Trimmer (M-Power Play)	5.0 out of 5 stars	Positive		10-03-2015
Ganesh	5	0	0	Works fine using since couple of months ...no problems of shaving looks exactly as shaved	0	1	B00CE3FT66	Philips QT4005/15 Beard and Stubble Trimmer (M-Power Play)	5.0 out of 5 stars	Positive		10-05-2015
sandeep rapolu	5	0	0	Again an awesome product at a reasonable price.	0	1	B00CE3FT66	Philips QT4005/15 Beard and Stubble Trimmer (M-Power Play)	5.0 out of 5 stars	Positive		10-05-2015
vineet kachapur	5	0	0	"Best trimmer for normal usage, very smooth functioning.. Has many adjustables for trimming.."	0	1	B00CE3FT66	Philips QT4005/15 Beard and Stubble Trimmer (M-Power Play)	5.0 out of 5 stars	Positive		10-05-2015
Diptanu Bhattacharjee	5	0	0	Awesome tool. Real Man stuff with ease of use	0	1	B00CE3FT66	Philips QT4005/15 Beard and Stubble Trimmer (M-Power Play)	5.0 out of 5 stars	Positive		10-11-2014
RKC	5	0	0	"Brilliant product at an amazing price. Really AMAZE-ON.', 'Easy to operate.', 'Easy to clean.', 'Handy and cute."	0	1	B00CE3FT66	Philips QT4005/15 Beard and Stubble Trimmer (M-Power Play)	5.0 out of 5 stars	Positive		10-11-2014
VINEETH	5	0	0	Good stylish strimmer.got only for 935..thank u amazon..	0	1	B00CE3FT66	Philips QT4005/15 Beard and Stubble Trimmer (M-Power Play)	5.0 out of 5 stars	Positive		10-11-2014
Anas Jamil	5	0	0	fantastic product good design and easy to use washable blades all in good price i got my delivery today and enjoying it Thanks amazon.. u guys rocking!!!	0	1	B00CE3FT66	Philips QT4005/15 Beard and Stubble Trimmer (M-Power Play)	5.0 out of 5 stars	Positive		10-10-2014
SANJAY CHOPRA	5	0	0	GREAT PRODUCT AT GREATEST PRICE @ Rs.975	0	1	B00CE3FT66	Philips QT4005/15 Beard and Stubble Trimmer (M-Power Play)	5.0 out of 5 stars	Positive		10-10-2014
akshay badaya	5	0	0	this is my 2nd QT4005/15 trimmer..first i was bought from flipkart and then 2nd from Amazon..A great trimmer with slik design..the only problem is you can't use this while charging...BUT YOU WILL LOVE IT	0	1	B00CE3FT66	Philips QT4005/15 Beard and Stubble Trimmer (M-Power Play)	5.0 out of 5 stars	Positive		10-10-2014
jerin jain	5	0	0	Works perfectly genuine trimmer go for it	0	1	B00CE3FT66	Philips QT4005/15 Beard and Stubble Trimmer (M-Power Play)	5.0 out of 5 stars	Positive		10-10-2014
nic95	5	0	0	"Excellent product. Easy to use. Good battery life. Easy to clean. At this price, it exceeds expectations."	0	1	B00CE3FT66	Philips QT4005/15 Beard and Stubble Trimmer (M-Power Play)	5.0 out of 5 stars	Positive		10-10-2014
srinivas rachiraju	5	0	0	it was a gift to my son. he liked it very much	0	1	B00CE3FT66	Philips QT4005/15 Beard and Stubble Trimmer (M-Power Play)	5.0 out of 5 stars	Positive		10-10-2014
Amazon Customer	5	0	0	"Really', 'Its a good product.', 'I m impressed"	0	1	B00CE3FT66	Philips QT4005/15 Beard and Stubble Trimmer (M-Power Play)	5.0 out of 5 stars	Positive		10-10-2015
Amjad Altaf Shaikh	5	0	0	A good quality product. Best trimmer i ever used. Delivery was also in time and the product was in undamaged condition.	0	1	B00CE3FT66	Philips QT4005/15 Beard and Stubble Trimmer (M-Power Play)	5.0 out of 5 stars	Positive		10-09-2014
Prabhu Shanmugam	5	0	0	Received the package at the earliest very nice product.	0	1	B00CE3FT66	Philips QT4005/15 Beard and Stubble Trimmer (M-Power Play)	5.0 out of 5 stars	Positive		10-09-2014
Sheetal Bahl	5	0	0	Works perfectly. Great value for money. Totally recommended.	0	1	B00CE3FT66	Philips QT4005/15 Beard and Stubble Trimmer (M-Power Play)	5.0 out of 5 stars	Positive		10-09-2014
Laxmikant Kolapkar	5	0	0	"Fit for Parlor Usage', 'Good value for money product, hassel free trimming, best for parlor usage, small childs hair trimming after hair cuts."	0	1	B00CE3FT66	Philips QT4005/15 Beard and Stubble Trimmer (M-Power Play)	5.0 out of 5 stars	Positive		10-09-2015
Thameem Ansar Rasheed Ali	5	0	0	Its really good and cost effective.....	0	1	B00CE3FT66	Philips QT4005/15 Beard and Stubble Trimmer (M-Power Play)	5.0 out of 5 stars	Positive		10-09-2015
Ajith	5	0	0	"the trimmer was really superb and awesome. It reduced my time of trimming than before.', 'No doubts just buy it.."	0	1	B00CE3FT66	Philips QT4005/15 Beard and Stubble Trimmer (M-Power Play)	5.0 out of 5 stars	Positive		11-04-2014
Anuj Sharma	5	0	0	"I Bought this product around 30 days Back from Amazon and Below are my views on it', 'Pros', '1. Excellent delivery by Amazon. I got it in less than 24 Hours', '2. Great Product. I am doing shaving from 2004 and still using this product it gives me finish like i did shaving, so u guys can well imagine the product quality."	0	1	B00CE3FT66	Philips QT4005/15 Beard and Stubble Trimmer (M-Power Play)	5.0 out of 5 stars	Positive		11-04-2014
Rahul	5	0	0	"My friend recommended for this and it is best. Advantages: 3 years warranty, Good battery backup and easy to use"	0	1	B00CE3FT66	Philips QT4005/15 Beard and Stubble Trimmer (M-Power Play)	5.0 out of 5 stars	Positive		11-04-2014
Deepak Sharma	5	0	0	It is a good device for trimming here...good product	0	1	B00CE3FT66	Philips QT4005/15 Beard and Stubble Trimmer (M-Power Play)	5.0 out of 5 stars	Positive		11-04-2015
Prasanta Kumar Pattnaik	5	0	0	Good quality product. Works many times in a single charge. Product from amazon has always been genuine. Thanks	0	1	B00CE3FT66	Philips QT4005/15 Beard and Stubble Trimmer (M-Power Play)	5.0 out of 5 stars	Positive		11-04-2015
aswani Kumar	5	0	0	"very useful product...best trimmer,,,very easy to trim....no scratches on skin...everyone must use it."	0	1	B00CE3FT66	Philips QT4005/15 Beard and Stubble Trimmer (M-Power Play)	5.0 out of 5 stars	Positive		11-08-2014
vallinayagam	5	0	0	excellent quality!! takes more time to charge but then thats fine considering the price	0	1	B00CE3FT66	Philips QT4005/15 Beard and Stubble Trimmer (M-Power Play)	5.0 out of 5 stars	Positive		11-08-2014
Dishant Shah	5	0	0	Have been using it since last couple of months. It has been one of the best grooming products I've ever used!	0	1	B00CE3FT66	Philips QT4005/15 Beard and Stubble Trimmer (M-Power Play)	5.0 out of 5 stars	Positive		11-08-2015
Agniswar Dasmitra	5	0	0	Great trimmer very easy to use and very light. Looks awesome	0	1	B00CE3FT66	Philips QT4005/15 Beard and Stubble Trimmer (M-Power Play)	5.0 out of 5 stars	Positive		11-12-2014
Nisanth S	5	0	0	Its excellent and it is the product I required	0	1	B00CE3FT66	Philips QT4005/15 Beard and Stubble Trimmer (M-Power Play)	5.0 out of 5 stars	Positive		11-02-2015
Sabyasachi Roy	5	0	0	This works smooth and allows you to handle the cut with precision. Very handy and great buy for personal care	0	1	B00CE3FT66	Philips QT4005/15 Beard and Stubble Trimmer (M-Power Play)	5.0 out of 5 stars	Positive		11-02-2015
Ashish Shetti	5	0	0	"Got this product within 2 days of order that too free Shipping.', ""The product is my first online Shopping stuff, my 1st trimmer and it's gr8."", 'Its already charged for 1st time use....', 'Nice packaging by Amazon..."	0	1	B00CE3FT66	Philips QT4005/15 Beard and Stubble Trimmer (M-Power Play)	5.0 out of 5 stars	Positive		11-01-2014
MAZHAR HUSSAIN	5	0	0	A good and essential product. Worth buying.	0	1	B00CE3FT66	Philips QT4005/15 Beard and Stubble Trimmer (M-Power Play)	5.0 out of 5 stars	Positive		11-01-2015
